{"attempt_policy":{"max_capture_attempts":1,"max_concurrent_manual_runs":1,"replay_allowed":false,"retries_allowed":false},"authority_profile":"manual_independent_capture_research_only_v1","contract_version":"manual-independent-capture-v1","paths":{"browser_profile":"/srv/greyhound-manual-operations/manual-independent-capture-v1/browser-profile","manual_lock":"/srv/greyhound-manual-operations/manual-independent-capture-v1/manual-capture.lock","manual_root":"/srv/greyhound-manual-operations/manual-independent-capture-v1","operations_root":"/srv/greyhound-manual-operations","runs_root":"/srv/greyhound-manual-operations/manual-independent-capture-v1/runs"},"safety":{"canonical":false,"phase7_eligible":false,"phase7_excluded":true,"phase7_exclusion_reason":"manual_research_only_noncanonical","research_only":true},"schema_version":"manual_independent_capture_config_v1","timing":{"cancellation_grace_seconds":10,"hard_timeout_seconds":90,"minimum_prejump_margin_seconds":120}}
